v · m Langages de programmation,Concurrents,Déclaratifs,Fonctionnels,Impératifs,Orientés objet
Ada Erlang Go Modula-2
Clips Prolog
Common Lisp Erlang F# Gallina Haskell Lisp ML OCaml Opa Scheme Standard ML
Algol APL Assembleur BASIC BCPL C COBOL Forth Fortran Julia Limbo Lua Modula-2 Natural NQC NXC OPL Pascal Perl PL/I PowerShell Rust Tcl WLangage
ActionScript AppleScript C++ C# CoffeeScript D Delphi Eiffel Groovy Java JavaScript Lisaac Logo Objective-C PHP Python Ruby Scala Simula Smalltalk Swift Kotlin Visual Basic
Liste de langages de programmation
